fund_name,yahoo_ticker,aum_total_assets,inception_date,ytd_return,annualized_ytd_return
BlackRock ICS US Treasury Fund,0P0000ZECB,29872615424.0,2012-03-09,0.05101048997271995,0.04078927564136525
MORGAN STANLEY LIQUIDITY FUNDS - US DOLLAR TREASURY LIQUIDITY FUND,0P0001EC37,16587105280.0,2013-06-14,0.04978406660753287,0.03981322926441688
Legg Mason Western Asset US Government Liquidity Fund,0P00008MQZ,2067765760.0,2018-10-10,0.044080072118740654,0.0352707688939673
HSBC US Government Liquidity Fund,0P0001HDTT,55279665152.0,2006-08-14,0.053734792161516554,0.04295660573740201
PICTET - SOVEREIGN SHORT-TERM MONEY MARKET USD,0P0000G7Q6,1780011648.0,2024-04-30,0.05010789219160805,0.03997996132325565
SPIKO US T-BILLS MONEY MARKET FUND,SPIKO:USTBL,,,0.04756575483264247,0.037960895354625324
