fund_name,yahoo_ticker,aum_total_assets,inception_date,ytd_return,annualized_ytd_return
BlackRock ICS US Treasury Fund,0P0000ZECB,27089199104.0,2018-05-16,0.034270209123661965,0.04286771668397016
MORGAN STANLEY LIQUIDITY FUNDS - US DOLLAR TREASURY LIQUIDITY FUND,0P0001EC37,17028977664.0,2014-01-16,0.03344394954567331,0.04183001207951942
Legg Mason Western Asset US Government Liquidity Fund,0P00008MQZ,2052921216.0,2004-02-27,0.029826110531990135,0.03728874681305161
HSBC US Government Liquidity Fund,0P0001HDTT,49244606464.0,2002-03-08,0.036016375634306375,0.04506140812263748
PICTET - SOVEREIGN SHORT-TERM MONEY MARKET USD,0P0000G7Q6,1748249856.0,2024-04-30,0.0336411769077789,0.04163651075790509
SPIKO US T-BILLS MONEY MARKET FUND,SPIKO:USTBL,,,0.031768468379197,0.03931032410391233
