fund_name,yahoo_ticker,aum_total_assets,inception_date,ytd_return,annualized_ytd_return
AMUNDI EURO LIQUIDITY SHORT TERM GOVIES,0P0000YA35.F,2918692096.0,2024-02-22,0.026039635098304315,0.018275151079057084
BlackRock ICS Euro Government Liquidity Fund,0P0001S9RE.F,6195369984.0,2010-11-11,0.024360734110867588,0.01710103036330657
Goldman Sachs Euro Government Liquid Reserves Fund,0P0001TA89.F,898173696.0,2025-02-21,0.02896363016056447,0.020318660142802702
MORGAN STANLEY LIQUIDITY FUNDS - EURO GOVERNMENT LIQUIDITY FUND,0P0001SYG6.F,379164480.0,2025-01-29,0.02829585762127973,0.019852121508647125
EURIZON INVESTMENT SICAV - EURO LIQUIDITY SHORT TERM,0P0001DIYP.F,134647168.0,2018-06-07,0.028510618025007206,0.020041783788855128
JPMORGAN LIQUIDITY FUNDS - EUR GOVERNMENT CNAV FUND,0P0001SWVV.F,1920599936.0,2024-10-07,0.027885506374545788,0.019565385599251917
SPIKO EU T-BILLS MONEY MARKET FUND,SPIKO:EUTBL,,,0.02782336048760481,0.01952195776104504
