fund_name,yahoo_ticker,aum_total_assets,inception_date,ytd_return,annualized_ytd_return
BlackRock ICS US Treasury Fund,0P0000ZECB,29872615424.0,2012-03-09,0.05152763212483191,0.04073688166324896
MORGAN STANLEY LIQUIDITY FUNDS - US DOLLAR TREASURY LIQUIDITY FUND,0P0001EC37,16587105280.0,2013-06-14,0.05029048195845087,0.03976368761674176
Legg Mason Western Asset US Government Liquidity Fund,0P00008MQZ,2067765760.0,2004-02-27,0.04449199781069013,0.03519921521726643
HSBC US Government Liquidity Fund,0P0001HDTT,55279665152.0,2002-03-08,0.05428825429446005,0.04290765558602194
PICTET - SOVEREIGN SHORT-TERM MONEY MARKET USD,0P0000G7Q6,1780011648.0,2024-05-07,0.0507166874752778,0.040008917758524554
SPIKO US T-BILLS MONEY MARKET FUND,SPIKO:USTBL,,,0.048045667476883436,0.037911960320919036
