fund_name,yahoo_ticker,aum_total_assets,inception_date,ytd_return,annualized_ytd_return
AMUNDI EURO LIQUIDITY SHORT TERM GOVIES,0P0000YA35.F,2903093248.0,2020-05-15,0.02338260138459325,0.01849680448653057
BlackRock ICS Euro Government Liquidity Fund,0P0001S9RE.F,5771552768.0,2012-07-10,0.021814374637591394,0.017259017023249168
Goldman Sachs Euro Government Liquid Reserves Fund,0P0001TA89.F,1227703936.0,2025-02-21,0.025972638864983244,0.02054023865796606
MORGAN STANLEY LIQUIDITY FUNDS - EURO GOVERNMENT LIQUIDITY FUND,0P0001SYG6.F,467293568.0,2025-01-29,0.02539355357765327,0.02008345672844114
EURIZON INVESTMENT SICAV - EURO LIQUIDITY SHORT TERM,0P0001DIYP.F,107243624.0,2018-06-07,0.02527597927854619,0.020035276461752405
JPMORGAN LIQUIDITY FUNDS - EUR GOVERNMENT CNAV FUND,0P0001SWVV.F,1829224192.0,2024-05-13,0.02494260671632409,0.01972771327759859
SPIKO EU T-BILLS MONEY MARKET FUND,SPIKO:EUTBL,,,0.02472015472074096,0.019552213169593546
