fund_name,yahoo_ticker,aum_total_assets,inception_date,ytd_return,annualized_ytd_return
BlackRock ICS US Treasury Fund,0P0000ZECB,27255486464.0,2018-05-16,0.02716460515633523,0.042843652371428176
MORGAN STANLEY LIQUIDITY FUNDS - US DOLLAR TREASURY LIQUIDITY FUND,0P0001EC37,19995711488.0,2013-06-14,0.02651373806034285,0.041809538528257084
Legg Mason Western Asset US Government Liquidity Fund,0P00008MQZ,1859915136.0,2007-11-15,0.023564311985089015,0.037128062496017966
HSBC US Government Liquidity Fund,0P0001HDTT,49513500672.0,2019-05-15,0.028519020274094142,0.04499676818693388
PICTET - SOVEREIGN SHORT-TERM MONEY MARKET USD,0P0000G7Q6,2459327232.0,2024-04-30,0.026499242559903102,0.041601906407037204
SPIKO US T-BILLS MONEY MARKET FUND,SPIKO:USTBL,,,0.025000145722462674,0.03923224566454486
