fund_name,yahoo_ticker,aum_total_assets,inception_date,ytd_return,annualized_ytd_return
BlackRock ICS US Treasury Fund,0P0000ZECB,30943885312.0,2025-09-04,0.05791786147850275,0.04030159155709989
MORGAN STANLEY LIQUIDITY FUNDS - US DOLLAR TREASURY LIQUIDITY FUND,0P0001EC37,18461882368.0,2013-06-14,0.05651218815852688,0.039331387818594576
Legg Mason Western Asset US Government Liquidity Fund,0P00008MQZ,2115469568.0,2004-02-27,0.04984753469105163,0.034726153806383
HSBC US Government Liquidity Fund,0P0001HDTT,52429934592.0,2002-03-08,0.06108504555419092,0.04248619228582484
PICTET - SOVEREIGN SHORT-TERM MONEY MARKET USD,0P0000G7Q6,2394830336.0,2024-04-30,0.05707823655375477,0.03948668079003248
SPIKO US T-BILLS MONEY MARKET FUND,SPIKO:USTBL,,,0.054263159224134716,0.03755457936131679
