fund_name,yahoo_ticker,aum_total_assets,inception_date,ytd_return,annualized_ytd_return
BlackRock ICS US Treasury Fund,0P0000ZECB,30943885312.0,2025-09-04,0.057504533923945944,0.04017607517357891
MORGAN STANLEY LIQUIDITY FUNDS - US DOLLAR TREASURY LIQUIDITY FUND,0P0001EC37,18461882368.0,2013-06-14,0.05610867795458496,0.03920861840278089
Legg Mason Western Asset US Government Liquidity Fund,0P00008MQZ,2115469568.0,2007-04-20,0.04951795642111567,0.03463552547328419
HSBC US Government Liquidity Fund,0P0001HDTT,52429934592.0,2006-08-14,0.06064404890588926,0.04235067068332787
PICTET - SOVEREIGN SHORT-TERM MONEY MARKET USD,0P0000G7Q6,2394830336.0,2024-04-30,0.05663604317483384,0.03949537551542592
SPIKO US T-BILLS MONEY MARKET FUND,SPIKO:USTBL,,,0.0538308492510835,0.03755420414091759
