fund_name,yahoo_ticker,aum_total_assets,inception_date,ytd_return,annualized_ytd_return
AMUNDI EURO LIQUIDITY SHORT TERM GOVIES,0P0000YA35.F,2918692096.0,2024-02-22,0.025339504240780908,0.018328361869208942
BlackRock ICS Euro Government Liquidity Fund,0P0001S9RE.F,6195369984.0,2010-10-01,0.023679605498350575,0.01713156894231016
Goldman Sachs Euro Government Liquid Reserves Fund,0P0001TA89.F,898173696.0,2025-02-21,0.028164975933757885,0.02036431615840284
MORGAN STANLEY LIQUIDITY FUNDS - EURO GOVERNMENT LIQUIDITY FUND,0P0001SYG6.F,379164480.0,2025-01-29,0.027524440435205744,0.019902899164559118
EURIZON INVESTMENT SICAV - EURO LIQUIDITY SHORT TERM,0P0001DIYP.F,134647168.0,2018-06-07,0.027852034132874515,0.020179987254261622
JPMORGAN LIQUIDITY FUNDS - EUR GOVERNMENT CNAV FUND,0P0001SWVV.F,1920599936.0,2024-10-07,0.027095500205938983,0.019593863125839217
SPIKO EU T-BILLS MONEY MARKET FUND,SPIKO:EUTBL,,,0.027146457246674194,0.019550974342651406
