fund_name,yahoo_ticker,aum_total_assets,inception_date,ytd_return,annualized_ytd_return
BlackRock ICS US Treasury Fund,0P0000ZECB,29902485504.0,2012-03-09,0.048635819550277404,0.041046969503727215
MORGAN STANLEY LIQUIDITY FUNDS - US DOLLAR TREASURY LIQUIDITY FUND,0P0001EC37,17197084672.0,2014-01-16,0.04747699720251286,0.04007240007695323
Legg Mason Western Asset US Government Liquidity Fund,0P00008MQZ,2000686848.0,2004-02-27,0.04202025507711138,0.03548106065596612
HSBC US Government Liquidity Fund,0P0001HDTT,56856559616.0,2006-08-14,0.05175453371975003,0.0436689901707461
PICTET - SOVEREIGN SHORT-TERM MONEY MARKET USD,0P0000G7Q6,1548627712.0,2019-11-18,0.04765861972815966,0.040128860525916465
SPIKO US T-BILLS MONEY MARKET FUND,SPIKO:USTBL,,,0.045456665054004475,0.03818978494207803
