fund_name,yahoo_ticker,aum_total_assets,inception_date,ytd_return,annualized_ytd_return
AMUNDI EURO LIQUIDITY SHORT TERM GOVIES,0P0000YA35.F,3253663232.0,2013-03-15,0.017308053454042627,0.01930973625321486
BlackRock ICS Euro Government Liquidity Fund,0P0001S9RE.F,5161393664.0,2010-10-01,0.016171371190107697,0.018040434299195995
Goldman Sachs Euro Government Liquid Reserves Fund,0P0001TA89.F,1089225088.0,2024-07-02,0.019187103506356218,0.021408376197085355
MORGAN STANLEY LIQUIDITY FUNDS - EURO GOVERNMENT LIQUIDITY FUND,0P0001SYG6.F,472940576.0,2024-09-18,0.018726488675622877,0.020893891872041603
EURIZON INVESTMENT SICAV - EURO LIQUIDITY SHORT TERM,0P0001DIYP.F,173004208.0,2018-06-07,0.018903757498322182,0.02115808024664112
JPMORGAN LIQUIDITY FUNDS - EUR GOVERNMENT CNAV FUND,0P0001SWVV.F,1689465984.0,2024-05-13,0.018405623566601914,0.020535516923158026
SPIKO EU T-BILLS MONEY MARKET FUND,SPIKO:EUTBL,,,0.018273457188067832,0.02038790376389854
