fund_name,yahoo_ticker,aum_total_assets,inception_date,ytd_return,annualized_ytd_return
AMUNDI EURO LIQUIDITY SHORT TERM GOVIES,0P0000YA35.F,3436174848.0,2024-02-22,0.014962963684881814,0.019851696784497275
BlackRock ICS Euro Government Liquidity Fund,0P0001S9RE.F,5248587264.0,2013-07-04,0.01400874718759093,0.018582873098135
Goldman Sachs Euro Government Liquid Reserves Fund,0P0001TA89.F,1000180992.0,2024-07-02,0.016556106924192848,0.0219709627829201
MORGAN STANLEY LIQUIDITY FUNDS - EURO GOVERNMENT LIQUIDITY FUND,0P0001SYG6.F,521433440.0,2024-09-18,0.01615998778072747,0.02144392803223072
EURIZON INVESTMENT SICAV - EURO LIQUIDITY SHORT TERM,0P0001DIYP.F,188897616.0,2018-06-07,0.016114676585185173,0.021463393184189883
JPMORGAN LIQUIDITY FUNDS - EUR GOVERNMENT CNAV FUND,0P0001SWVV.F,1618535296.0,2024-10-07,0.015888560465922907,0.021082833575946536
SPIKO EU T-BILLS MONEY MARKET FUND,SPIKO:EUTBL,,,0.01580026958916969,0.02096538216851962
