fund_name,yahoo_ticker,aum_total_assets,inception_date,ytd_return,annualized_ytd_return
AMUNDI EURO LIQUIDITY SHORT TERM GOVIES,0P0000YA35.F,2966062848.0,2024-02-22,0.021147115568072028,0.01872884763937921
BlackRock ICS Euro Government Liquidity Fund,0P0001S9RE.F,6139265536.0,2008-12-10,0.01972441716710227,0.017470229768212553
Goldman Sachs Euro Government Liquid Reserves Fund,0P0001TA89.F,1342450560.0,2025-02-21,0.023472462133320215,0.02078558322988666
MORGAN STANLEY LIQUIDITY FUNDS - EURO GOVERNMENT LIQUIDITY FUND,0P0001SYG6.F,362032864.0,2025-01-29,0.022927922171703363,0.020303992984306962
EURIZON INVESTMENT SICAV - EURO LIQUIDITY SHORT TERM,0P0001DIYP.F,127689864.0,2018-06-07,0.023281076535818013,0.020667752397437456
JPMORGAN LIQUIDITY FUNDS - EUR GOVERNMENT CNAV FUND,0P0001SWVV.F,1837602432.0,2024-10-07,0.022472486981103712,0.019950810227904014
SPIKO EU T-BILLS MONEY MARKET FUND,SPIKO:EUTBL,,,0.022469671218425802,0.01989869408862588
