fund_name,yahoo_ticker,aum_total_assets,inception_date,ytd_return,annualized_ytd_return
AMUNDI EURO LIQUIDITY SHORT TERM GOVIES,0P0000YA35.F,3253663232.0,2013-03-15,0.017217641438390663,0.01932959982204796
BlackRock ICS Euro Government Liquidity Fund,0P0001S9RE.F,5161393664.0,2010-10-01,0.016086137709509618,0.01805807496963041
Goldman Sachs Euro Government Liquid Reserves Fund,0P0001TA89.F,1089225088.0,2024-07-02,0.01908577094961772,0.02142928230199903
MORGAN STANLEY LIQUIDITY FUNDS - EURO GOVERNMENT LIQUIDITY FUND,0P0001SYG6.F,472940576.0,2024-09-18,0.018626224101153888,0.020912731633277115
EURIZON INVESTMENT SICAV - EURO LIQUIDITY SHORT TERM,0P0001DIYP.F,173004208.0,2018-06-07,0.018806938218541847,0.021182539863329408
JPMORGAN LIQUIDITY FUNDS - EUR GOVERNMENT CNAV FUND,0P0001SWVV.F,1689465984.0,2024-05-13,0.018307721313588265,0.02055473724153023
SPIKO EU T-BILLS MONEY MARKET FUND,SPIKO:EUTBL,,,0.01817480318037079,0.0204053424268531
