fund_name,yahoo_ticker,aum_total_assets,inception_date,ytd_return,annualized_ytd_return
BlackRock ICS US Treasury Fund,0P0000ZECB,32344125440.0,2013-08-13,0.05545797684207199,0.04036766257598012
MORGAN STANLEY LIQUIDITY FUNDS - US DOLLAR TREASURY LIQUIDITY FUND,0P0001EC37,19421544448.0,2019-04-01,0.0541169462306097,0.039398315638640824
Legg Mason Western Asset US Government Liquidity Fund,0P00008MQZ,2127485312.0,2007-11-15,0.04778771764942236,0.03481886260766065
HSBC US Government Liquidity Fund,0P0001HDTT,48075395072.0,2015-10-08,0.058447621700333796,0.042527507488423044
PICTET - SOVEREIGN SHORT-TERM MONEY MARKET USD,0P0000G7Q6,1857617920.0,2024-05-07,0.05455938036062835,0.039635852797339055
SPIKO US T-BILLS MONEY MARKET FUND,SPIKO:USTBL,,,0.05179170625460228,0.037716765190714874
