fund_name,yahoo_ticker,aum_total_assets,inception_date,ytd_return,annualized_ytd_return
AMUNDI EURO LIQUIDITY SHORT TERM GOVIES,0P0000YA35.F,2860785152.0,2020-05-15,0.02879982547332305,0.01825568885421691
BlackRock ICS Euro Government Liquidity Fund,0P0001S9RE.F,6711573504.0,2010-10-01,0.027012729875362407,0.01712832333481007
Goldman Sachs Euro Government Liquid Reserves Fund,0P0001TA89.F,978342656.0,2025-02-21,0.032044043835599556,0.02030044691356525
MORGAN STANLEY LIQUIDITY FUNDS - EURO GOVERNMENT LIQUIDITY FUND,0P0001SYG6.F,482592704.0,2025-01-29,0.03128519373520322,0.019822369923709893
EURIZON INVESTMENT SICAV - EURO LIQUIDITY SHORT TERM,0P0001DIYP.F,201518608.0,2018-06-07,0.031532112496200915,0.020085650961597423
JPMORGAN LIQUIDITY FUNDS - EUR GOVERNMENT CNAV FUND,0P0001SWVV.F,1946401536.0,2024-10-17,0.030898964492459102,0.019578995762291163
SPIKO EU T-BILLS MONEY MARKET FUND,SPIKO:EUTBL,,,0.030830842563832173,0.019536066742624314
