fund_name,yahoo_ticker,aum_total_assets,inception_date,ytd_return,annualized_ytd_return
BlackRock ICS US Treasury Fund,0P0000ZECB,32227082240.0,2013-08-13,0.06164990937301007,0.03986053405341505
MORGAN STANLEY LIQUIDITY FUNDS - US DOLLAR TREASURY LIQUIDITY FUND,0P0001EC37,18230923264.0,2018-09-26,0.060142589478927144,0.038895690214848955
Legg Mason Western Asset US Government Liquidity Fund,0P00008MQZ,2109200640.0,2007-11-15,0.05306084424714319,0.03435624369487167
HSBC US Government Liquidity Fund,0P0001HDTT,55764090880.0,2015-10-08,0.065071539799896,0.042048978135249104
PICTET - SOVEREIGN SHORT-TERM MONEY MARKET USD,0P0000G7Q6,2167660288.0,2024-05-07,0.06078687476275446,0.039235569468322185
SPIKO US T-BILLS MONEY MARKET FUND,SPIKO:USTBL,,,0.05781490138475176,0.037335777589739605
