fund_name,yahoo_ticker,aum_total_assets,inception_date,ytd_return,annualized_ytd_return
AMUNDI EURO LIQUIDITY SHORT TERM GOVIES,0P0000YA35.F,3436174848.0,2013-03-15,0.015053900480060722,0.019825414479832215
BlackRock ICS Euro Government Liquidity Fund,0P0001S9RE.F,5248587264.0,2023-03-20,0.01409398066818901,0.018558465439508787
Goldman Sachs Euro Government Liquid Reserves Fund,0P0001TA89.F,1000180992.0,2024-07-02,0.016660320975435905,0.02194648794585974
MORGAN STANLEY LIQUIDITY FUNDS - EURO GOVERNMENT LIQUIDITY FUND,0P0001SYG6.F,521433440.0,2024-09-18,0.0164136737892826,0.021541291685937214
EURIZON INVESTMENT SICAV - EURO LIQUIDITY SHORT TERM,0P0001DIYP.F,188897616.0,2018-06-07,0.01636647764248944,0.02155842662258811
JPMORGAN LIQUIDITY FUNDS - EUR GOVERNMENT CNAV FUND,0P0001SWVV.F,1618535296.0,2024-05-13,0.016135323859505668,0.021175083567628317
SPIKO EU T-BILLS MONEY MARKET FUND,SPIKO:EUTBL,,,0.016060091035183355,0.020922354657267883
