fund_name,yahoo_ticker,aum_total_assets,inception_date,ytd_return,annualized_ytd_return
BlackRock ICS US Treasury Fund,0P0000ZECB,32227082240.0,2013-08-13,0.06154532244118904,0.04009035488709878
MORGAN STANLEY LIQUIDITY FUNDS - US DOLLAR TREASURY LIQUIDITY FUND,0P0001EC37,18230923264.0,2018-09-26,0.06004117247579743,0.039120193286066085
Legg Mason Western Asset US Government Liquidity Fund,0P00008MQZ,2109200640.0,2007-11-15,0.05297849682512967,0.03455852937168857
HSBC US Government Liquidity Fund,0P0001HDTT,55764090880.0,2015-10-08,0.06496773343597817,0.04229602628146267
PICTET - SOVEREIGN SHORT-TERM MONEY MARKET USD,0P0000G7Q6,2167660288.0,2024-05-07,0.06027684348249851,0.039272229791724955
SPIKO US T-BILLS MONEY MARKET FUND,SPIKO:USTBL,,,0.05728932903549211,0.03734406291349357
