fund_name,yahoo_ticker,aum_total_assets,inception_date,ytd_return,annualized_ytd_return
AMUNDI EURO LIQUIDITY SHORT TERM GOVIES,0P0000YA35.F,2985788416.0,1995-05-23,0.02734213788432127,0.01821408766781918
BlackRock ICS Euro Government Liquidity Fund,0P0001S9RE.F,6640600576.0,2023-03-20,0.025634874849455258,0.017081520085976187
Goldman Sachs Euro Government Liquid Reserves Fund,0P0001TA89.F,1039542720.0,2024-07-02,0.030451729972460706,0.020275336507718178
MORGAN STANLEY LIQUIDITY FUNDS - EURO GOVERNMENT LIQUIDITY FUND,0P0001SYG6.F,481279456.0,2024-09-18,0.02972761457269213,0.019795527669539625
EURIZON INVESTMENT SICAV - EURO LIQUIDITY SHORT TERM,0P0001DIYP.F,165930384.0,2018-06-07,0.02976950509507037,0.019973250161963385
JPMORGAN LIQUIDITY FUNDS - EUR GOVERNMENT CNAV FUND,0P0001SWVV.F,1891407872.0,2024-05-13,0.02928845330884755,0.019541152767293513
SPIKO EU T-BILLS MONEY MARKET FUND,SPIKO:EUTBL,,,0.02924065717243951,0.019472800209729746
