fund_name,yahoo_ticker,aum_total_assets,inception_date,ytd_return,annualized_ytd_return
AMUNDI EURO LIQUIDITY SHORT TERM GOVIES,0P0000YA35.F,2903093248.0,1995-05-23,0.02254003036974095,0.018574791593938933
BlackRock ICS Euro Government Liquidity Fund,0P0001S9RE.F,5771552768.0,2023-03-20,0.02111676114547878,0.01740403021972492
Goldman Sachs Euro Government Liquid Reserves Fund,0P0001TA89.F,1227703936.0,2024-07-02,0.025141519800093493,0.020714006755775616
MORGAN STANLEY LIQUIDITY FUNDS - EURO GOVERNMENT LIQUIDITY FUND,0P0001SYG6.F,467293568.0,2024-09-18,0.024564820744937155,0.02023986653237797
EURIZON INVESTMENT SICAV - EURO LIQUIDITY SHORT TERM,0P0001DIYP.F,107243624.0,2018-06-07,0.024675557884157096,0.020378124790362717
JPMORGAN LIQUIDITY FUNDS - EUR GOVERNMENT CNAV FUND,0P0001SWVV.F,1829224192.0,2024-05-13,0.024133957052270283,0.019885596284902496
SPIKO EU T-BILLS MONEY MARKET FUND,SPIKO:EUTBL,,,0.023950458106233752,0.019643717398025284
