fund_name,yahoo_ticker,aum_total_assets,inception_date,ytd_return,annualized_ytd_return
AMUNDI EURO LIQUIDITY SHORT TERM GOVIES,0P0000YA35.F,3087491840.0,2024-02-22,0.018513696933075918,0.01910276206171191
BlackRock ICS Euro Government Liquidity Fund,0P0001S9RE.F,5443663872.0,2010-10-01,0.01727785405012061,0.017827254223781175
Goldman Sachs Euro Government Liquid Reserves Fund,0P0001TA89.F,1209545216.0,2024-07-02,0.020523732757136814,0.021177415091607754
MORGAN STANLEY LIQUIDITY FUNDS - EURO GOVERNMENT LIQUIDITY FUND,0P0001SYG6.F,408225120.0,2025-01-29,0.020037111503129257,0.02067513845715574
EURIZON INVESTMENT SICAV - EURO LIQUIDITY SHORT TERM,0P0001DIYP.F,150885968.0,2018-06-07,0.02008521278785258,0.020784955561355067
JPMORGAN LIQUIDITY FUNDS - EUR GOVERNMENT CNAV FUND,0P0001SWVV.F,1789334144.0,2024-10-17,0.01968619268463656,0.020312934708268893
SPIKO EU T-BILLS MONEY MARKET FUND,SPIKO:EUTBL,,,0.019568657328723038,0.020191620500820573
