fund_name,yahoo_ticker,aum_total_assets,inception_date,ytd_return,annualized_ytd_return
BlackRock ICS US Treasury Fund,0P0000ZECB,29872615424.0,2012-03-09,0.0521493612087649,0.04094916951616989
MORGAN STANLEY LIQUIDITY FUNDS - US DOLLAR TREASURY LIQUIDITY FUND,0P0001EC37,16587105280.0,2013-06-14,0.050892064108344126,0.039967009271684395
Legg Mason Western Asset US Government Liquidity Fund,0P00008MQZ,2067765760.0,2004-02-27,0.04498639664590787,0.03535037459246437
HSBC US Government Liquidity Fund,0P0001HDTT,55279665152.0,2002-03-08,0.05493676058582664,0.0431257161953551
PICTET - SOVEREIGN SHORT-TERM MONEY MARKET USD,0P0000G7Q6,1780011648.0,2024-05-07,0.05094314635179242,0.040006917904360284
SPIKO US T-BILLS MONEY MARKET FUND,SPIKO:USTBL,,,0.04832448312242432,0.03796052828806329
