fund_name,yahoo_ticker,aum_total_assets,inception_date,ytd_return,annualized_ytd_return
AMUNDI EURO LIQUIDITY SHORT TERM GOVIES,0P0000YA35.F,2966062848.0,1995-05-23,0.021749487496565578,0.01865852939547219
BlackRock ICS Euro Government Liquidity Fund,0P0001S9RE.F,6139265536.0,2023-03-20,0.020289338466956464,0.017407655361828978
Goldman Sachs Euro Government Liquid Reserves Fund,0P0001TA89.F,1342450560.0,2024-07-02,0.02415307113526266,0.020717072868962516
MORGAN STANLEY LIQUIDITY FUNDS - EURO GOVERNMENT LIQUIDITY FUND,0P0001SYG6.F,362032864.0,2024-09-18,0.02359158896666247,0.02023625375881588
EURIZON INVESTMENT SICAV - EURO LIQUIDITY SHORT TERM,0P0001DIYP.F,127689864.0,2018-06-07,0.023920272928702913,0.02056730999691614
JPMORGAN LIQUIDITY FUNDS - EUR GOVERNMENT CNAV FUND,0P0001SWVV.F,1837602432.0,2024-05-13,0.023177402324337182,0.019881545758292374
SPIKO EU T-BILLS MONEY MARKET FUND,SPIKO:EUTBL,,,0.023113364199339737,0.019826701926173307
