fund_name,yahoo_ticker,aum_total_assets,inception_date,ytd_return,annualized_ytd_return
BlackRock ICS US Treasury Fund,0P0000ZECB,27089199104.0,2018-05-16,0.03449882006632543,0.042553361918605814
MORGAN STANLEY LIQUIDITY FUNDS - US DOLLAR TREASURY LIQUIDITY FUND,0P0001EC37,17028977664.0,2018-09-26,0.0336665014578974,0.04152285047768589
Legg Mason Western Asset US Government Liquidity Fund,0P00008MQZ,2052921216.0,2007-05-08,0.02999093109727191,0.03697431885352653
HSBC US Government Liquidity Fund,0P0001HDTT,49244606464.0,2002-03-08,0.03625841867549684,0.04473258252864509
PICTET - SOVEREIGN SHORT-TERM MONEY MARKET USD,0P0000G7Q6,1748249856.0,2024-04-30,0.03387081568591843,0.04163078669216769
SPIKO US T-BILLS MONEY MARKET FUND,SPIKO:USTBL,,,0.03194527830075944,0.03925578559908027
