fund_name,yahoo_ticker,aum_total_assets,inception_date,ytd_return,annualized_ytd_return
BlackRock ICS US Treasury Fund,0P0000ZECB,32344125440.0,2012-03-09,0.053285657997257374,0.04056546306641384
MORGAN STANLEY LIQUIDITY FUNDS - US DOLLAR TREASURY LIQUIDITY FUND,0P0001EC37,19421544448.0,2013-06-14,0.05199649006392404,0.03958980058692263
Legg Mason Western Asset US Government Liquidity Fund,0P00008MQZ,2127485312.0,2018-10-10,0.04597506859508815,0.035028981228742095
HSBC US Government Liquidity Fund,0P0001HDTT,48075395072.0,2006-08-14,0.05613872901013672,0.042723718931407584
PICTET - SOVEREIGN SHORT-TERM MONEY MARKET USD,0P0000G7Q6,1857617920.0,2019-11-18,0.05245253965649077,0.03984852308438169
SPIKO US T-BILLS MONEY MARKET FUND,SPIKO:USTBL,,,0.049833196354218234,0.03786987275783549
