fund_name,yahoo_ticker,aum_total_assets,inception_date,ytd_return,annualized_ytd_return
AMUNDI EURO LIQUIDITY SHORT TERM GOVIES,0P0000YA35.F,3436174848.0,2013-03-15,0.01523809809403831,0.019776977503819237
BlackRock ICS Euro Government Liquidity Fund,0P0001S9RE.F,5248587264.0,2023-03-20,0.014263560550662913,0.0185095238880304
Goldman Sachs Euro Government Liquid Reserves Fund,0P0001TA89.F,1000180992.0,2024-07-02,0.01686692413140234,0.021896179794604675
MORGAN STANLEY LIQUIDITY FUNDS - EURO GOVERNMENT LIQUIDITY FUND,0P0001SYG6.F,521433440.0,2024-09-18,0.016464259762374533,0.021372195591121024
EURIZON INVESTMENT SICAV - EURO LIQUIDITY SHORT TERM,0P0001DIYP.F,188897616.0,2018-06-07,0.016424640140233038,0.02155572008342932
JPMORGAN LIQUIDITY FUNDS - EUR GOVERNMENT CNAV FUND,0P0001SWVV.F,1618535296.0,2024-05-13,0.0161852310627022,0.021009133492019272
SPIKO EU T-BILLS MONEY MARKET FUND,SPIKO:EUTBL,,,0.016115767059329267,0.020918754002524187
