fund_name,yahoo_ticker,aum_total_assets,inception_date,ytd_return,annualized_ytd_return
BlackRock ICS US Treasury Fund,0P0000ZECB,27089199104.0,2018-05-16,0.03620291126252573,0.04244313377733322
MORGAN STANLEY LIQUIDITY FUNDS - US DOLLAR TREASURY LIQUIDITY FUND,0P0001EC37,17028977664.0,2018-09-26,0.03532421929555585,0.04140998014120556
Legg Mason Western Asset US Government Liquidity Fund,0P00008MQZ,2052921216.0,2007-05-08,0.03147400188166993,0.036884695515217336
HSBC US Government Liquidity Fund,0P0001HDTT,49244606464.0,2002-03-08,0.03805714483637046,0.04462380079847095
PICTET - SOVEREIGN SHORT-TERM MONEY MARKET USD,0P0000G7Q6,1748249856.0,2024-04-30,0.035552734241529826,0.04154100468722621
SPIKO US T-BILLS MONEY MARKET FUND,SPIKO:USTBL,,,0.033557940222702864,0.03920390546785035
