fund_name,yahoo_ticker,aum_total_assets,inception_date,ytd_return,annualized_ytd_return
AMUNDI EURO LIQUIDITY SHORT TERM GOVIES,0P0000YA35.F,3334068480.0,1995-05-23,0.013489982521093236,0.020303063481897254
BlackRock ICS Euro Government Liquidity Fund,0P0001S9RE.F,4962206720.0,2023-03-20,0.012731723443154763,0.0191582430841446
Goldman Sachs Euro Government Liquid Reserves Fund,0P0001TA89.F,707534080.0,2024-07-02,0.01500893647495638,0.022597670143498894
MORGAN STANLEY LIQUIDITY FUNDS - EURO GOVERNMENT LIQUIDITY FUND,0P0001SYG6.F,480023520.0,2024-09-18,0.014643618416923632,0.02204564577337398
EURIZON INVESTMENT SICAV - EURO LIQUIDITY SHORT TERM,0P0001DIYP.F,195575680.0,2018-06-07,0.014700807737598298,0.022225681086148308
JPMORGAN LIQUIDITY FUNDS - EUR GOVERNMENT CNAV FUND,0P0001SWVV.F,1655168768.0,2024-05-13,0.014409318611791955,0.021691652607878753
SPIKO EU T-BILLS MONEY MARKET FUND,SPIKO:EUTBL,,,0.01432925042489619,0.021390527204558918
