fund_name,yahoo_ticker,aum_total_assets,inception_date,ytd_return,annualized_ytd_return
AMUNDI EURO LIQUIDITY SHORT TERM GOVIES,0P0000YA35.F,2948276480.0,1995-05-23,0.02059002461590831,0.018796630046500118
BlackRock ICS Euro Government Liquidity Fund,0P0001S9RE.F,5663531520.0,2023-03-20,0.019292261982733372,0.01761287576521431
Goldman Sachs Euro Government Liquid Reserves Fund,0P0001TA89.F,1231001344.0,2024-07-02,0.022953120773808067,0.0209517949202358
MORGAN STANLEY LIQUIDITY FUNDS - EURO GOVERNMENT LIQUIDITY FUND,0P0001SYG6.F,475912512.0,2025-01-29,0.022419264711331044,0.020464951007388654
EURIZON INVESTMENT SICAV - EURO LIQUIDITY SHORT TERM,0P0001DIYP.F,142774016.0,2018-06-07,0.022796861920457046,0.020862797135227984
JPMORGAN LIQUIDITY FUNDS - EUR GOVERNMENT CNAV FUND,0P0001SWVV.F,1943767168.0,2024-10-17,0.022020262706928362,0.02010107138187367
SPIKO EU T-BILLS MONEY MARKET FUND,SPIKO:EUTBL,,,0.021897282619312897,0.019886962873450376
