fund_name,yahoo_ticker,aum_total_assets,inception_date,ytd_return,annualized_ytd_return
AMUNDI EURO LIQUIDITY SHORT TERM GOVIES,0P0000YA35.F,2966062848.0,2020-05-15,0.02235380860615943,0.01859377101067028
BlackRock ICS Euro Government Liquidity Fund,0P0001S9RE.F,6139265536.0,2013-07-04,0.020855146845533357,0.017349327302280004
Goldman Sachs Euro Government Liquid Reserves Fund,0P0001TA89.F,1342450560.0,2025-02-21,0.024828781596547778,0.020648248912669365
MORGAN STANLEY LIQUIDITY FUNDS - EURO GOVERNMENT LIQUIDITY FUND,0P0001SYG6.F,362032864.0,2025-01-29,0.02425638997626467,0.020173179554223264
EURIZON INVESTMENT SICAV - EURO LIQUIDITY SHORT TERM,0P0001DIYP.F,127689864.0,2018-06-07,0.024423756826852827,0.02045557965582967
JPMORGAN LIQUIDITY FUNDS - EUR GOVERNMENT CNAV FUND,0P0001SWVV.F,1837602432.0,2024-05-13,0.023780495500129506,0.01991784373356764
SPIKO EU T-BILLS MONEY MARKET FUND,SPIKO:EUTBL,,,0.023663287034323854,0.019680873685645528
