fund_name,yahoo_ticker,aum_total_assets,inception_date,ytd_return,annualized_ytd_return
AMUNDI EURO LIQUIDITY SHORT TERM GOVIES,0P0000YA35.F,2918692096.0,1995-05-23,0.02566479257901766,0.018302154353788902
BlackRock ICS Euro Government Liquidity Fund,0P0001S9RE.F,6195369984.0,2023-03-20,0.023996440448779133,0.017116402191533542
Goldman Sachs Euro Government Liquid Reserves Fund,0P0001TA89.F,898173696.0,2024-07-02,0.028535728226659174,0.02034133904414448
MORGAN STANLEY LIQUIDITY FUNDS - EURO GOVERNMENT LIQUIDITY FUND,0P0001SYG6.F,379164480.0,2024-09-18,0.027884364548684593,0.019878826775471037
EURIZON INVESTMENT SICAV - EURO LIQUIDITY SHORT TERM,0P0001DIYP.F,134647168.0,2018-06-07,0.02820065446995934,0.020143871747460018
JPMORGAN LIQUIDITY FUNDS - EUR GOVERNMENT CNAV FUND,0P0001SWVV.F,1920599936.0,2024-05-13,0.02746358973143037,0.019580003895850018
SPIKO EU T-BILLS MONEY MARKET FUND,SPIKO:EUTBL,,,0.027403348375627745,0.01953721926968388
