fund_name,yahoo_ticker,aum_total_assets,inception_date,ytd_return,annualized_ytd_return
BlackRock ICS US Treasury Fund,0P0000ZECB,29044752384.0,2012-03-09,0.040179596035711196,0.042087212750750114
MORGAN STANLEY LIQUIDITY FUNDS - US DOLLAR TREASURY LIQUIDITY FUND,0P0001EC37,17358012416.0,2018-09-26,0.03922032869972458,0.041081508851404935
Legg Mason Western Asset US Government Liquidity Fund,0P00008MQZ,1952699392.0,2018-10-10,0.034934479425056564,0.036588716554655676
HSBC US Government Liquidity Fund,0P0001HDTT,59651424256.0,2002-03-08,0.042251045640369744,0.044259084951684846
PICTET - SOVEREIGN SHORT-TERM MONEY MARKET USD,0P0000G7Q6,1436615040.0,2008-06-16,0.0394280990573026,0.04117719373084783
SPIKO US T-BILLS MONEY MARKET FUND,SPIKO:USTBL,,,0.03757793723053493,0.03924341624110661
