fund_name,yahoo_ticker,aum_total_assets,inception_date,ytd_return,annualized_ytd_return
BlackRock ICS US Treasury Fund,0P0000ZECB,30943885312.0,2013-08-13,0.05688949840364943,0.04023149683253924
MORGAN STANLEY LIQUIDITY FUNDS - US DOLLAR TREASURY LIQUIDITY FUND,0P0001EC37,18461882368.0,2019-04-01,0.05550977446361527,0.03926325203611092
Legg Mason Western Asset US Government Liquidity Fund,0P00008MQZ,2115469568.0,2007-04-20,0.04902362044652553,0.03470660200999065
HSBC US Government Liquidity Fund,0P0001HDTT,52429934592.0,2015-10-08,0.05998688349379844,0.042403818877984056
PICTET - SOVEREIGN SHORT-TERM MONEY MARKET USD,0P0000G7Q6,2394830336.0,2024-05-07,0.05605094127582144,0.03956319263178454
SPIKO US T-BILLS MONEY MARKET FUND,SPIKO:USTBL,,,0.053297505037139814,0.03763408460991302
