fund_name,yahoo_ticker,aum_total_assets,inception_date,ytd_return,annualized_ytd_return
AMUNDI EURO LIQUIDITY SHORT TERM GOVIES,0P0000YA35.F,2869204992.0,1995-05-23,0.02501234168994748,0.018353874124638736
BlackRock ICS Euro Government Liquidity Fund,0P0001S9RE.F,6066885632.0,2023-03-20,0.02336373154987137,0.017147801607432234
Goldman Sachs Euro Government Liquid Reserves Fund,0P0001TA89.F,877431296.0,2024-07-02,0.027797105135361155,0.020389960023321274
MORGAN STANLEY LIQUIDITY FUNDS - EURO GOVERNMENT LIQUIDITY FUND,0P0001SYG6.F,347540032.0,2024-09-18,0.02716428947879823,0.0199274033813035
EURIZON INVESTMENT SICAV - EURO LIQUIDITY SHORT TERM,0P0001DIYP.F,173977792.0,2018-06-07,0.027464638797294105,0.020188651811590574
JPMORGAN LIQUIDITY FUNDS - EUR GOVERNMENT CNAV FUND,0P0001SWVV.F,1784644096.0,2024-05-13,0.026732286671564243,0.019611587725731905
SPIKO EU T-BILLS MONEY MARKET FUND,SPIKO:EUTBL,,,0.026649280118775653,0.01955090177018559
