fund_name,yahoo_ticker,aum_total_assets,inception_date,ytd_return,annualized_ytd_return
BlackRock ICS US Treasury Fund,0P0000ZECB,32344125440.0,2013-08-13,0.053699049913003005,0.04052640395838658
MORGAN STANLEY LIQUIDITY FUNDS - US DOLLAR TREASURY LIQUIDITY FUND,0P0001EC37,19421544448.0,2019-04-01,0.05240401825625107,0.039554987907553185
Legg Mason Western Asset US Government Liquidity Fund,0P00008MQZ,2127485312.0,2007-05-08,0.04630464686502411,0.03497591553124679
HSBC US Government Liquidity Fund,0P0001HDTT,48075395072.0,2015-10-08,0.056579828743209104,0.04268627562912486
PICTET - SOVEREIGN SHORT-TERM MONEY MARKET USD,0P0000G7Q6,1857617920.0,2024-04-30,0.052867672696092605,0.03981715613748538
SPIKO US T-BILLS MONEY MARKET FUND,SPIKO:USTBL,,,0.05021110327448097,0.03782810469209652
