fund_name,yahoo_ticker,aum_total_assets,inception_date,ytd_return,annualized_ytd_return
AMUNDI EURO LIQUIDITY SHORT TERM GOVIES,0P0000YA35.F,2948276480.0,2020-05-15,0.020449983450702813,0.018813476445202815
BlackRock ICS Euro Government Liquidity Fund,0P0001S9RE.F,5663531520.0,2025-09-04,0.019077219315725147,0.017551510031978745
Goldman Sachs Euro Government Liquid Reserves Fund,0P0001TA89.F,1230991232.0,2025-02-21,0.0226954191152966,0.020877389807092195
MORGAN STANLEY LIQUIDITY FUNDS - EURO GOVERNMENT LIQUIDITY FUND,0P0001SYG6.F,475912512.0,2025-01-29,0.022164217645204154,0.02038916343998598
EURIZON INVESTMENT SICAV - EURO LIQUIDITY SHORT TERM,0P0001DIYP.F,142774016.0,2018-06-07,0.022545060863152777,0.020792924333799423
JPMORGAN LIQUIDITY FUNDS - EUR GOVERNMENT CNAV FUND,0P0001SWVV.F,1943767168.0,2024-10-17,0.02176862332222873,0.020025560302719958
SPIKO EU T-BILLS MONEY MARKET FUND,SPIKO:EUTBL,,,0.021647228896833237,0.0199139806449129
