fund_name,yahoo_ticker,aum_total_assets,inception_date,ytd_return,annualized_ytd_return
BlackRock ICS US Treasury Fund,0P0000ZECB,27255486464.0,2008-09-29,0.026570744467158125,0.042850883733703826
MORGAN STANLEY LIQUIDITY FUNDS - US DOLLAR TREASURY LIQUIDITY FUND,0P0001EC37,19995711488.0,2025-01-29,0.02593083211572167,0.04181098134428818
Legg Mason Western Asset US Government Liquidity Fund,0P00008MQZ,1859915136.0,2007-04-20,0.02306991314987128,0.0371665475334122
HSBC US Government Liquidity Fund,0P0001HDTT,49513500672.0,2019-05-15,0.027896491344899577,0.045006552964354185
PICTET - SOVEREIGN SHORT-TERM MONEY MARKET USD,0P0000G7Q6,2459327232.0,2008-06-16,0.02578663284082694,0.041576701139534045
SPIKO US T-BILLS MONEY MARKET FUND,SPIKO:USTBL,,,0.024421141803499857,0.03935917086797369
