fund_name,yahoo_ticker,aum_total_assets,inception_date,ytd_return,annualized_ytd_return
AMUNDI EURO LIQUIDITY SHORT TERM GOVIES,0P0000YA35.F,2869204992.0,2013-03-15,0.024080783061016575,0.018432963780046663
BlackRock ICS Euro Government Liquidity Fund,0P0001S9RE.F,6066885632.0,2010-10-01,0.022468447349068832,0.01720195014552539
Goldman Sachs Euro Government Liquid Reserves Fund,0P0001TA89.F,877431296.0,2025-02-21,0.02674958583318987,0.020469597689644514
MORGAN STANLEY LIQUIDITY FUNDS - EURO GOVERNMENT LIQUIDITY FUND,0P0001SYG6.F,347540032.0,2025-01-29,0.02608035835133582,0.020002079371292947
EURIZON INVESTMENT SICAV - EURO LIQUIDITY SHORT TERM,0P0001DIYP.F,173977792.0,2018-06-07,0.026263796008515916,0.020185910276292685
JPMORGAN LIQUIDITY FUNDS - EUR GOVERNMENT CNAV FUND,0P0001SWVV.F,1784644096.0,2024-05-13,0.025704313014919045,0.019672069128146452
SPIKO EU T-BILLS MONEY MARKET FUND,SPIKO:EUTBL,,,0.02556017894469531,0.01956208203033838
