fund_name,yahoo_ticker,aum_total_assets,inception_date,ytd_return,annualized_ytd_return
BlackRock ICS US Treasury Fund,0P0000ZECB,30943885312.0,2025-09-04,0.05863999401698394,0.04023972902450912
MORGAN STANLEY LIQUIDITY FUNDS - US DOLLAR TREASURY LIQUIDITY FUND,0P0001EC37,18461882368.0,2013-06-14,0.05721615460505003,0.03927092660768183
Legg Mason Western Asset US Government Liquidity Fund,0P00008MQZ,2115469568.0,2004-02-27,0.05050669123092355,0.034700287525618156
HSBC US Government Liquidity Fund,0P0001HDTT,52429934592.0,2002-03-08,0.06186333557164736,0.042431460825121725
PICTET - SOVEREIGN SHORT-TERM MONEY MARKET USD,0P0000G7Q6,2394830336.0,2024-04-30,0.05786760036891847,0.03948198499401978
SPIKO US T-BILLS MONEY MARKET FUND,SPIKO:USTBL,,,0.05494805479941767,0.03750643200023562
