fund_name,yahoo_ticker,aum_total_assets,inception_date,ytd_return,annualized_ytd_return
BlackRock ICS US Treasury Fund,0P0000ZECB,29872615424.0,2013-08-13,0.04946337571603432,0.040956032960093314
MORGAN STANLEY LIQUIDITY FUNDS - US DOLLAR TREASURY LIQUIDITY FUND,0P0001EC37,16587105280.0,2019-04-01,0.04828334794566569,0.039982808284851235
Legg Mason Western Asset US Government Liquidity Fund,0P00008MQZ,2067765760.0,2007-11-15,0.042761759038996816,0.035426434644104665
HSBC US Government Liquidity Fund,0P0001HDTT,55279665152.0,2015-10-08,0.052100486209628594,0.04313031620331853
PICTET - SOVEREIGN SHORT-TERM MONEY MARKET USD,0P0000G7Q6,1780011648.0,2024-05-07,0.048497864353128195,0.0400653804591522
SPIKO US T-BILLS MONEY MARKET FUND,SPIKO:USTBL,,,0.046133788764603834,0.03811979295970058
