fund_name,yahoo_ticker,aum_total_assets,inception_date,ytd_return,annualized_ytd_return
BlackRock ICS US Treasury Fund,0P0000ZECB,29044752384.0,2012-03-09,0.04144500136896245,0.041920303284726845
MORGAN STANLEY LIQUIDITY FUNDS - US DOLLAR TREASURY LIQUIDITY FUND,0P0001EC37,17358012416.0,2018-09-26,0.04045600894255408,0.040919747488814995
Legg Mason Western Asset US Government Liquidity Fund,0P00008MQZ,1952699392.0,2018-10-10,0.03600556165687796,0.036417397642736216
HSBC US Government Liquidity Fund,0P0001HDTT,59651424256.0,2002-03-08,0.043600116032217695,0.04410065266723717
PICTET - SOVEREIGN SHORT-TERM MONEY MARKET USD,0P0000G7Q6,1436615040.0,2008-06-16,0.040589386660574656,0.041054684045388035
SPIKO US T-BILLS MONEY MARKET FUND,SPIKO:USTBL,,,0.038601880402660216,0.03893250046901131
