fund_name,yahoo_ticker,aum_total_assets,inception_date,ytd_return,annualized_ytd_return
BlackRock ICS US Treasury Fund,0P0000ZECB,29044752384.0,2012-03-09,0.04197141153226358,0.04209075023398934
MORGAN STANLEY LIQUIDITY FUNDS - US DOLLAR TREASURY LIQUIDITY FUND,0P0001EC37,17358012416.0,2018-09-26,0.04097157637812732,0.04108801653248828
Legg Mason Western Asset US Government Liquidity Fund,0P00008MQZ,1952699392.0,2018-10-10,0.03641755020945481,0.03652082210335239
HSBC US Government Liquidity Fund,0P0001HDTT,59651424256.0,2002-03-08,0.0441621342011147,0.04428783322946073
PICTET - SOVEREIGN SHORT-TERM MONEY MARKET USD,0P0000G7Q6,1436615040.0,2008-06-16,0.04129551187437608,0.04106273860816034
SPIKO US T-BILLS MONEY MARKET FUND,SPIKO:USTBL,,,0.03909150787775628,0.038871388572849774
