fund_name,yahoo_ticker,aum_total_assets,inception_date,ytd_return,annualized_ytd_return
AMUNDI EURO LIQUIDITY SHORT TERM GOVIES,0P0000YA35.F,2860785152.0,2020-05-15,0.028422508993409146,0.018245801445072818
BlackRock ICS Euro Government Liquidity Fund,0P0001S9RE.F,6711573504.0,2011-10-31,0.02670358294052999,0.017116528656983876
Goldman Sachs Euro Government Liquid Reserves Fund,0P0001TA89.F,978342656.0,2025-02-21,0.03169000421082391,0.02029508939529623
MORGAN STANLEY LIQUIDITY FUNDS - EURO GOVERNMENT LIQUIDITY FUND,0P0001SYG6.F,482592704.0,2025-01-29,0.030938350897277145,0.019816303687409276
EURIZON INVESTMENT SICAV - EURO LIQUIDITY SHORT TERM,0P0001DIYP.F,201518608.0,2018-06-07,0.03118349215911609,0.020008615302645083
JPMORGAN LIQUIDITY FUNDS - EUR GOVERNMENT CNAV FUND,0P0001SWVV.F,1946401536.0,2024-10-07,0.0305494228547456,0.019568516770086752
SPIKO EU T-BILLS MONEY MARKET FUND,SPIKO:EUTBL,,,0.030482134833655694,0.01952564404506374
