fund_name,yahoo_ticker,aum_total_assets,inception_date,ytd_return,annualized_ytd_return
AMUNDI EURO LIQUIDITY SHORT TERM GOVIES,0P0000YA35.F,3334068480.0,2013-03-15,0.012799222726552095,0.020557256415841385
BlackRock ICS Euro Government Liquidity Fund,0P0001S9RE.F,4962206720.0,2010-09-24,0.012002101193800963,0.019272395930001407
Goldman Sachs Euro Government Liquid Reserves Fund,0P0001TA89.F,707534080.0,2024-07-02,0.01412278086503238,0.02269200740292776
MORGAN STANLEY LIQUIDITY FUNDS - EURO GOVERNMENT LIQUIDITY FUND,0P0001SYG6.F,480023520.0,2024-09-18,0.01378494231762395,0.0221469526897613
EURIZON INVESTMENT SICAV - EURO LIQUIDITY SHORT TERM,0P0001DIYP.F,195575680.0,2018-06-07,0.013926017066437257,0.02247554415081554
JPMORGAN LIQUIDITY FUNDS - EUR GOVERNMENT CNAV FUND,0P0001SWVV.F,1655168768.0,2024-05-13,0.013569309632319726,0.02179911682313329
SPIKO EU T-BILLS MONEY MARKET FUND,SPIKO:EUTBL,,,0.0136865342163357,0.021695771245155315
