fund_name,yahoo_ticker,aum_total_assets,inception_date,ytd_return,annualized_ytd_return
AMUNDI EURO LIQUIDITY SHORT TERM GOVIES,0P0000YA35.F,2918692096.0,2024-02-22,0.026320692019265346,0.018255333599054513
BlackRock ICS Euro Government Liquidity Fund,0P0001S9RE.F,6195369984.0,2011-10-31,0.02463491535938367,0.01709041929049171
Goldman Sachs Euro Government Liquid Reserves Fund,0P0001TA89.F,898173696.0,2025-02-21,0.029287125943593395,0.020303804722019203
MORGAN STANLEY LIQUIDITY FUNDS - EURO GOVERNMENT LIQUIDITY FUND,0P0001SYG6.F,379164480.0,2025-01-29,0.028604893304428503,0.019832847854442948
EURIZON INVESTMENT SICAV - EURO LIQUIDITY SHORT TERM,0P0001DIYP.F,134647168.0,2018-06-07,0.028801075864348435,0.020007368546693938
JPMORGAN LIQUIDITY FUNDS - EUR GOVERNMENT CNAV FUND,0P0001SWVV.F,1920599936.0,2024-10-07,0.02820273262015105,0.01955518501254394
SPIKO EU T-BILLS MONEY MARKET FUND,SPIKO:EUTBL,,,0.02811346187657504,0.019493545553421754
