fund_name,yahoo_ticker,aum_total_assets,inception_date,ytd_return,annualized_ytd_return
AMUNDI EURO LIQUIDITY SHORT TERM GOVIES,0P0000YA35.F,3436174848.0,2013-03-15,0.014640674086799255,0.019941249907437175
BlackRock ICS Euro Government Liquidity Fund,0P0001S9RE.F,5248587264.0,2023-03-20,0.013712241124555602,0.018673601499840986
Goldman Sachs Euro Government Liquid Reserves Fund,0P0001TA89.F,1000180992.0,2024-07-02,0.01619611221077477,0.02206592015081199
MORGAN STANLEY LIQUIDITY FUNDS - EURO GOVERNMENT LIQUIDITY FUND,0P0001SYG6.F,521433440.0,2024-09-18,0.015805583511846022,0.021532362883049716
EURIZON INVESTMENT SICAV - EURO LIQUIDITY SHORT TERM,0P0001DIYP.F,188897616.0,2018-06-07,0.015766056248100346,0.02156059138517108
JPMORGAN LIQUIDITY FUNDS - EUR GOVERNMENT CNAV FUND,0P0001SWVV.F,1618535296.0,2024-05-13,0.015541982665947085,0.021172261525746583
SPIKO EU T-BILLS MONEY MARKET FUND,SPIKO:EUTBL,,,0.01545742249311366,0.021056752177272875
