fund_name,yahoo_ticker,aum_total_assets,inception_date,ytd_return,annualized_ytd_return
BlackRock ICS US Treasury Fund,0P0000ZECB,37803970560.0,2008-09-29,0.06226996506603388,0.03996143333100588
MORGAN STANLEY LIQUIDITY FUNDS - US DOLLAR TREASURY LIQUIDITY FUND,0P0001EC37,23618912256.0,2019-04-01,0.060742683484974025,0.03899132392814142
Legg Mason Western Asset US Government Liquidity Fund,0P00008MQZ,2363763968.0,2007-04-20,0.053555243082360704,0.03441934848515649
HSBC US Government Liquidity Fund,0P0001HDTT,54962794496.0,2002-03-08,0.0657373643327106,0.0421620629751569
PICTET - SOVEREIGN SHORT-TERM MONEY MARKET USD,0P0000G7Q6,2481150464.0,2024-05-07,0.06145203536150379,0.03922579698067974
SPIKO US T-BILLS MONEY MARKET FUND,SPIKO:USTBL,,,0.05837058970966247,0.037278391978444514
