fund_name,yahoo_ticker,aum_total_assets,inception_date,ytd_return,annualized_ytd_return
AMUNDI EURO LIQUIDITY SHORT TERM GOVIES,0P0000YA35.F,2860785152.0,2020-05-15,0.02885290317405409,0.01825655515907365
BlackRock ICS Euro Government Liquidity Fund,0P0001S9RE.F,6711573504.0,2010-11-11,0.027064032594820597,0.017130119425128765
Goldman Sachs Euro Government Liquid Reserves Fund,0P0001TA89.F,978342656.0,2025-02-21,0.03210311447294001,0.020301361628665804
MORGAN STANLEY LIQUIDITY FUNDS - EURO GOVERNMENT LIQUIDITY FUND,0P0001SYG6.F,482592704.0,2025-01-29,0.03134311429632186,0.01982343266307529
EURIZON INVESTMENT SICAV - EURO LIQUIDITY SHORT TERM,0P0001DIYP.F,201518608.0,2018-06-07,0.031570769278237654,0.020002298026450926
JPMORGAN LIQUIDITY FUNDS - EUR GOVERNMENT CNAV FUND,0P0001SWVV.F,1946401536.0,2024-10-07,0.030956711524510183,0.019580392677803093
SPIKO EU T-BILLS MONEY MARKET FUND,SPIKO:EUTBL,,,0.030911914669167206,0.019552214164439974
