fund_name,yahoo_ticker,aum_total_assets,inception_date,ytd_return,annualized_ytd_return
BlackRock ICS US Treasury Fund,0P0000ZECB,27089199104.0,2018-05-16,0.036313419423717574,0.0424324186886178
MORGAN STANLEY LIQUIDITY FUNDS - US DOLLAR TREASURY LIQUIDITY FUND,0P0001EC37,17028977664.0,2018-09-26,0.03543344905387902,0.041401229345190416
Legg Mason Western Asset US Government Liquidity Fund,0P00008MQZ,2052921216.0,2007-05-08,0.03155634930368345,0.03685959117547832
HSBC US Government Liquidity Fund,0P0001HDTT,49244606464.0,2002-03-08,0.03816950723624157,0.044607940699934456
PICTET - SOVEREIGN SHORT-TERM MONEY MARKET USD,0P0000G7Q6,1748249856.0,2024-04-30,0.03567855858426294,0.04155121056216737
SPIKO US T-BILLS MONEY MARKET FUND,SPIKO:USTBL,,,0.03369977675318703,0.039240596532436944
