fund_name,yahoo_ticker,aum_total_assets,inception_date,ytd_return,annualized_ytd_return
AMUNDI EURO LIQUIDITY SHORT TERM GOVIES,0P0000YA35.F,3253663232.0,2013-03-15,0.01796342811476337,0.01920111671731095
BlackRock ICS Euro Government Liquidity Fund,0P0001S9RE.F,5161393664.0,2010-10-01,0.01676630532007728,0.017920787723805454
Goldman Sachs Euro Government Liquid Reserves Fund,0P0001TA89.F,1089225088.0,2024-07-02,0.019906036385207493,0.021278964898737707
MORGAN STANLEY LIQUIDITY FUNDS - EURO GOVERNMENT LIQUIDITY FUND,0P0001SYG6.F,472940576.0,2024-09-18,0.01943053351188384,0.020770333625052206
EURIZON INVESTMENT SICAV - EURO LIQUIDITY SHORT TERM,0P0001DIYP.F,173004208.0,2018-06-07,0.019562341390454874,0.020974207216010177
JPMORGAN LIQUIDITY FUNDS - EUR GOVERNMENT CNAV FUND,0P0001SWVV.F,1689465984.0,2024-05-13,0.019095910936484772,0.020412407519814435
SPIKO EU T-BILLS MONEY MARKET FUND,SPIKO:EUTBL,,,0.018967942331360232,0.02027552914293973
