fund_name,yahoo_ticker,aum_total_assets,inception_date,ytd_return,annualized_ytd_return
AMUNDI EURO LIQUIDITY SHORT TERM GOVIES,0P0000YA35.F,2918692096.0,2024-02-22,0.026459233814393635,0.018244212295588813
BlackRock ICS Euro Government Liquidity Fund,0P0001S9RE.F,6195369984.0,2011-10-31,0.024865555827264574,0.017149465281452336
Goldman Sachs Euro Government Liquid Reserves Fund,0P0001TA89.F,898173696.0,2025-02-21,0.029557602227741064,0.020371082545187935
MORGAN STANLEY LIQUIDITY FUNDS - EURO GOVERNMENT LIQUIDITY FUND,0P0001SYG6.F,379164480.0,2025-01-29,0.028862586871389873,0.01989416185384707
EURIZON INVESTMENT SICAV - EURO LIQUIDITY SHORT TERM,0P0001DIYP.F,134647168.0,2018-06-07,0.029033489422404912,0.020050386346242455
JPMORGAN LIQUIDITY FUNDS - EUR GOVERNMENT CNAV FUND,0P0001SWVV.F,1920599936.0,2024-10-07,0.02846804390151192,0.019623381705095477
SPIKO EU T-BILLS MONEY MARKET FUND,SPIKO:EUTBL,,,0.028355701420227142,0.01947065938237391
