fund_name,yahoo_ticker,aum_total_assets,inception_date,ytd_return,annualized_ytd_return
AMUNDI EURO LIQUIDITY SHORT TERM GOVIES,0P0000YA35.F,3253663232.0,2013-03-15,0.016577410415449245,0.019466999072755842
BlackRock ICS Euro Government Liquidity Fund,0P0001S9RE.F,5161393664.0,2010-10-01,0.01549312558343896,0.018192028308248842
Goldman Sachs Euro Government Liquid Reserves Fund,0P0001TA89.F,1089225088.0,2024-07-02,0.018362900028277007,0.021567002368309218
MORGAN STANLEY LIQUIDITY FUNDS - EURO GOVERNMENT LIQUIDITY FUND,0P0001SYG6.F,472940576.0,2024-09-18,0.01792354032246468,0.021050190520394585
EURIZON INVESTMENT SICAV - EURO LIQUIDITY SHORT TERM,0P0001DIYP.F,173004208.0,2018-06-07,0.01818712932490474,0.021430788877069507
JPMORGAN LIQUIDITY FUNDS - EUR GOVERNMENT CNAV FUND,0P0001SWVV.F,1689465984.0,2024-05-13,0.01761858123573301,0.020691494627169904
SPIKO EU T-BILLS MONEY MARKET FUND,SPIKO:EUTBL,,,0.01750473734591429,0.02055759507484689
