fund_name,yahoo_ticker,aum_total_assets,inception_date,ytd_return,annualized_ytd_return
AMUNDI EURO LIQUIDITY SHORT TERM GOVIES,0P0000YA35.F,2985788416.0,2013-03-15,0.027020822876788975,0.01820583625965999
BlackRock ICS Euro Government Liquidity Fund,0P0001S9RE.F,6640600576.0,2011-10-31,0.025332602774723156,0.01707293583094449
Goldman Sachs Euro Government Liquid Reserves Fund,0P0001TA89.F,1039542720.0,2025-02-21,0.03010249283852562,0.020272276716971627
MORGAN STANLEY LIQUIDITY FUNDS - EURO GOVERNMENT LIQUIDITY FUND,0P0001SYG6.F,481279456.0,2025-01-29,0.02938387192145786,0.019790578144158966
EURIZON INVESTMENT SICAV - EURO LIQUIDITY SHORT TERM,0P0001DIYP.F,165930384.0,2018-06-07,0.029498434754976932,0.019905162962249756
JPMORGAN LIQUIDITY FUNDS - EUR GOVERNMENT CNAV FUND,0P0001SWVV.F,1891407872.0,2024-10-17,0.02900555021639839,0.01953694175141818
SPIKO EU T-BILLS MONEY MARKET FUND,SPIKO:EUTBL,,,0.02889390298696992,0.01946208487766321
