fund_name,yahoo_ticker,aum_total_assets,inception_date,ytd_return,annualized_ytd_return
BlackRock ICS US Treasury Fund,0P0000ZECB,32227082240.0,2013-08-13,0.061960387747843626,0.03983802228210909
MORGAN STANLEY LIQUIDITY FUNDS - US DOLLAR TREASURY LIQUIDITY FUND,0P0001EC37,18230923264.0,2018-09-26,0.06044349216466216,0.038872606328555825
Legg Mason Western Asset US Government Liquidity Fund,0P00008MQZ,2109200640.0,2007-11-15,0.05330801223443826,0.03432478282703677
HSBC US Government Liquidity Fund,0P0001HDTT,55764090880.0,2015-10-08,0.06540873008428005,0.04203089720478692
PICTET - SOVEREIGN SHORT-TERM MONEY MARKET USD,0P0000G7Q6,2167660288.0,2024-05-07,0.061123570228937885,0.03923330414400139
SPIKO US T-BILLS MONEY MARKET FUND,SPIKO:USTBL,,,0.05809663147954924,0.037309423575494716
