fund_name,yahoo_ticker,aum_total_assets,inception_date,ytd_return,annualized_ytd_return
BlackRock ICS US Treasury Fund,0P0000ZECB,29872615424.0,2013-08-13,0.050392172031793914,0.04085526386872562
MORGAN STANLEY LIQUIDITY FUNDS - US DOLLAR TREASURY LIQUIDITY FUND,0P0001EC37,16587105280.0,2019-04-01,0.04918538633813996,0.03988118179126854
Legg Mason Western Asset US Government Liquidity Fund,0P00008MQZ,2067765760.0,2007-11-15,0.04350332586150962,0.03529199056131582
HSBC US Government Liquidity Fund,0P0001HDTT,55279665152.0,2015-10-08,0.05308628587014996,0.0430291250457675
PICTET - SOVEREIGN SHORT-TERM MONEY MARKET USD,0P0000G7Q6,1780011648.0,2024-05-07,0.04946555206334469,0.04001501843966371
SPIKO US T-BILLS MONEY MARKET FUND,SPIKO:USTBL,,,0.04694303417483181,0.03798311846678226
