fund_name,yahoo_ticker,aum_total_assets,inception_date,ytd_return,annualized_ytd_return
AMUNDI EURO LIQUIDITY SHORT TERM GOVIES,0P0000YA35.F,2966062848.0,2024-02-22,0.021239476764824072,0.018717483715042782
BlackRock ICS Euro Government Liquidity Fund,0P0001S9RE.F,6139265536.0,2013-07-04,0.019897841057374244,0.017536519635559467
Goldman Sachs Euro Government Liquid Reserves Fund,0P0001TA89.F,1342450560.0,2025-02-21,0.023681946783790986,0.02086697998202225
MORGAN STANLEY LIQUIDITY FUNDS - EURO GOVERNMENT LIQUIDITY FUND,0P0001SYG6.F,362032864.0,2025-01-29,0.023131702735952553,0.02038279029190937
EURIZON INVESTMENT SICAV - EURO LIQUIDITY SHORT TERM,0P0001DIYP.F,127689864.0,2018-06-07,0.02353287759312228,0.02078728275209385
JPMORGAN LIQUIDITY FUNDS - EUR GOVERNMENT CNAV FUND,0P0001SWVV.F,1837602432.0,2024-05-13,0.022724126365803343,0.020024121907621373
SPIKO EU T-BILLS MONEY MARKET FUND,SPIKO:EUTBL,,,0.022690421770302338,0.019895963178388154
