fund_name,yahoo_ticker,aum_total_assets,inception_date,ytd_return,annualized_ytd_return
AMUNDI EURO LIQUIDITY SHORT TERM GOVIES,0P0000YA35.F,2985788416.0,2018-07-31,0.026694035168474795,0.01822858235839364
BlackRock ICS Euro Government Liquidity Fund,0P0001S9RE.F,6640600576.0,2010-11-11,0.02500408795444664,0.01707901881522389
Goldman Sachs Euro Government Liquid Reserves Fund,0P0001TA89.F,1039542720.0,2025-02-21,0.029718965919988127,0.020284766565264123
MORGAN STANLEY LIQUIDITY FUNDS - EURO GOVERNMENT LIQUIDITY FUND,0P0001SYG6.F,481279456.0,2025-01-29,0.029016991291499927,0.019807771551171527
EURIZON INVESTMENT SICAV - EURO LIQUIDITY SHORT TERM,0P0001DIYP.F,165930384.0,2018-06-07,0.029130426918644314,0.019923182256041727
JPMORGAN LIQUIDITY FUNDS - EUR GOVERNMENT CNAV FUND,0P0001SWVV.F,1891407872.0,2024-10-07,0.028627613101004146,0.01954314317067296
SPIKO EU T-BILLS MONEY MARKET FUND,SPIKO:EUTBL,,,0.028489519232647753,0.019449284546254386
