fund_name,yahoo_ticker,aum_total_assets,inception_date,ytd_return,annualized_ytd_return
BlackRock ICS US Treasury Fund,0P0000ZECB,27089199104.0,2018-05-16,0.034728267704443594,0.042540964319191854
MORGAN STANLEY LIQUIDITY FUNDS - US DOLLAR TREASURY LIQUIDITY FUND,0P0001EC37,17028977664.0,2018-09-26,0.03388949981327505,0.04150974675406305
Legg Mason Western Asset US Government Liquidity Fund,0P00008MQZ,2052921216.0,2007-05-08,0.030238099084566983,0.037022705835815906
HSBC US Government Liquidity Fund,0P0001HDTT,49244606464.0,2002-03-08,0.0365005648014578,0.044720508781250556
PICTET - SOVEREIGN SHORT-TERM MONEY MARKET USD,0P0000G7Q6,1748249856.0,2024-04-30,0.033980304063440325,0.04162137653623521
SPIKO US T-BILLS MONEY MARKET FUND,SPIKO:USTBL,,,0.03246307878533505,0.03921431358260796
