fund_name,yahoo_ticker,aum_total_assets,inception_date,ytd_return,annualized_ytd_return
BlackRock ICS US Treasury Fund,0P0000ZECB,28991004672.0,2012-03-09,0.04281248354767109,0.04174678133615628
MORGAN STANLEY LIQUIDITY FUNDS - US DOLLAR TREASURY LIQUIDITY FUND,0P0001EC37,17358012416.0,2013-06-14,0.04180010046459115,0.04076008820855659
Legg Mason Western Asset US Government Liquidity Fund,0P00008MQZ,1952699392.0,2004-02-27,0.03715905417134002,0.036236512131415655
HSBC US Government Liquidity Fund,0P0001HDTT,59651424256.0,2006-08-14,0.04507010485989027,0.043947029761613576
PICTET - SOVEREIGN SHORT-TERM MONEY MARKET USD,0P0000G7Q6,1436615040.0,2008-06-16,0.042031814978109816,0.04098592486106756
SPIKO US T-BILLS MONEY MARKET FUND,SPIKO:USTBL,,,0.04000275901196271,0.03890084564138041
